<?xml version="1.0" encoding="utf-8" standalone="yes"?>
<dimrConfig xmlns="http://schemas.deltares.nl/dimr" xmlns:xsi="http://www.w3.org/2001/XMLSchema-instance" xsi:schemaLocation="http://schemas.deltares.nl/dimr http://content.oss.deltares.nl/schemas/dimr-1.0.xsd">
    <documentation>
        <fileVersion>1.00</fileVersion>
        <createdBy>Deltares, dflowfm_to_dimr_xml.py</createdBy>
        <creationDate>2017-06-15T15:03:55.212000Z</creationDate>
    </documentation>
    <control>
        <start name="DFlowFM"/>
    </control>
    <component name="DFlowFM">
        <library>dflowfm</library>
        <process>0</process>
        <workingDir>.</workingDir>
        <inputFile>FlowFM.mdu</inputFile>
    </component>
</dimrConfig>
